[
  {"id":"coriander","name":"Coriander","aliases":["Dhaniya","కొత్తిమీర","Cilantro"],"category":"herb","emoji":"🌿","family":"Apiaceae","difficulty":1,"daysToGerminate":7,"daysToHarvest":30,"harvestWindowDays":40,"sunHoursMin":3,"sunHoursOptimal":5,"tempMinC":10,"tempOptimalC":20,"tempMaxC":30,"humidityPctRange":[50,75],"waterNeed":"medium","mlPerPlantPerDay":120,"soilPHRange":[6.2,6.8],"soilType":["loamy","well-drained"],"spacingCm":10,"depthCm":15,"containerSizeL":3,"kcal":23,"proteinG":2.1,"fiberG":2.8,"vitCmg":27,"ironMg":1.8,"seasons":["rabi","zaid"],"climateZones":["subtropical","temperate"],"indiaRegions":["all"],"yieldKgPerPlant":0.08,"commonPests":["aphids"],"commonDiseases":["powdery mildew"],"companions":["spinach","tomato","beans"],"antagonists":["fennel"]},
  {"id":"mint","name":"Mint","aliases":["Pudina","పుదీనా"],"category":"herb","emoji":"🌿","family":"Lamiaceae","difficulty":1,"daysToGerminate":14,"daysToHarvest":60,"harvestWindowDays":365,"sunHoursMin":3,"sunHoursOptimal":5,"tempMinC":15,"tempOptimalC":22,"tempMaxC":32,"humidityPctRange":[55,80],"waterNeed":"high","mlPerPlantPerDay":250,"soilPHRange":[6.0,7.0],"soilType":["loamy","moist"],"spacingCm":30,"depthCm":20,"containerSizeL":8,"kcal":70,"proteinG":3.8,"fiberG":8.0,"vitCmg":31,"ironMg":11.9,"seasons":["year-round"],"climateZones":["subtropical","temperate","humid"],"indiaRegions":["all"],"yieldKgPerPlant":0.3,"commonPests":["aphids","mint rust"],"commonDiseases":["rust"],"companions":["cabbage","tomato"],"antagonists":["parsley"]},
  {"id":"basil-sweet","name":"Sweet Basil","aliases":["Tulsi (sweet)","Italian Basil"],"category":"herb","emoji":"🌿","family":"Lamiaceae","difficulty":1,"daysToGerminate":7,"daysToHarvest":45,"harvestWindowDays":180,"sunHoursMin":6,"sunHoursOptimal":8,"tempMinC":15,"tempOptimalC":25,"tempMaxC":35,"humidityPctRange":[50,75],"waterNeed":"medium","mlPerPlantPerDay":200,"soilPHRange":[6.0,7.5],"soilType":["loamy","well-drained"],"spacingCm":25,"depthCm":20,"containerSizeL":6,"kcal":23,"proteinG":3.2,"fiberG":1.6,"vitCmg":18,"ironMg":3.2,"seasons":["kharif","zaid"],"climateZones":["tropical","subtropical"],"indiaRegions":["all"],"yieldKgPerPlant":0.15,"commonPests":["aphids","whitefly"],"commonDiseases":["fusarium wilt"],"companions":["tomato","peppers","oregano"],"antagonists":["rue","sage"]},
  {"id":"tulsi","name":"Holy Basil","aliases":["Tulsi","తులసి"],"category":"herb","emoji":"🌿","family":"Lamiaceae","difficulty":1,"daysToGerminate":10,"daysToHarvest":60,"harvestWindowDays":730,"sunHoursMin":5,"sunHoursOptimal":7,"tempMinC":18,"tempOptimalC":27,"tempMaxC":38,"humidityPctRange":[50,80],"waterNeed":"medium","mlPerPlantPerDay":200,"soilPHRange":[6.0,7.5],"soilType":["loamy"],"spacingCm":40,"depthCm":25,"containerSizeL":8,"kcal":23,"proteinG":3.2,"fiberG":1.6,"vitCmg":18,"ironMg":3.2,"seasons":["year-round"],"climateZones":["tropical","subtropical"],"indiaRegions":["all"],"yieldKgPerPlant":0.20,"commonPests":["aphids"],"commonDiseases":["leaf spot"],"companions":["tomato","chilli"],"antagonists":[]},
  {"id":"oregano","name":"Oregano","aliases":["Sathra"],"category":"herb","emoji":"🌿","family":"Lamiaceae","difficulty":2,"daysToGerminate":14,"daysToHarvest":80,"harvestWindowDays":730,"sunHoursMin":6,"sunHoursOptimal":8,"tempMinC":15,"tempOptimalC":22,"tempMaxC":30,"humidityPctRange":[40,65],"waterNeed":"low","mlPerPlantPerDay":120,"soilPHRange":[6.0,8.0],"soilType":["sandy","well-drained"],"spacingCm":30,"depthCm":20,"containerSizeL":5,"kcal":265,"proteinG":9.0,"fiberG":42.5,"vitCmg":2.3,"ironMg":36.8,"seasons":["rabi","zaid"],"climateZones":["temperate","arid"],"indiaRegions":["north","central"],"yieldKgPerPlant":0.10,"commonPests":["aphids"],"commonDiseases":["root rot"],"companions":["tomato","beans","peppers"],"antagonists":[]},
  {"id":"rosemary","name":"Rosemary","aliases":[],"category":"herb","emoji":"🌿","family":"Lamiaceae","difficulty":3,"daysToGerminate":21,"daysToHarvest":120,"harvestWindowDays":1825,"sunHoursMin":6,"sunHoursOptimal":8,"tempMinC":10,"tempOptimalC":22,"tempMaxC":32,"humidityPctRange":[40,60],"waterNeed":"low","mlPerPlantPerDay":100,"soilPHRange":[6.0,7.5],"soilType":["sandy","well-drained"],"spacingCm":60,"depthCm":30,"containerSizeL":10,"kcal":131,"proteinG":3.3,"fiberG":14.1,"vitCmg":22,"ironMg":6.6,"seasons":["rabi","zaid"],"climateZones":["temperate","arid"],"indiaRegions":["north","central","west"],"yieldKgPerPlant":0.15,"commonPests":["spittlebug"],"commonDiseases":["powdery mildew","root rot"],"companions":["carrot","beans","sage","cabbage"],"antagonists":[]},
  {"id":"thyme","name":"Thyme","aliases":["Banajwain"],"category":"herb","emoji":"🌿","family":"Lamiaceae","difficulty":2,"daysToGerminate":21,"daysToHarvest":90,"harvestWindowDays":1095,"sunHoursMin":6,"sunHoursOptimal":8,"tempMinC":10,"tempOptimalC":22,"tempMaxC":30,"humidityPctRange":[40,65],"waterNeed":"low","mlPerPlantPerDay":100,"soilPHRange":[6.0,8.0],"soilType":["sandy","well-drained"],"spacingCm":30,"depthCm":20,"containerSizeL":5,"kcal":101,"proteinG":5.6,"fiberG":14.0,"vitCmg":160,"ironMg":17.4,"seasons":["rabi","zaid"],"climateZones":["temperate","arid"],"indiaRegions":["north","central"],"yieldKgPerPlant":0.08,"commonPests":["aphids","spider mites"],"commonDiseases":["root rot"],"companions":["cabbage","strawberry","tomato"],"antagonists":[]},
  {"id":"parsley","name":"Parsley","aliases":["Ajamoda"],"category":"herb","emoji":"🌿","family":"Apiaceae","difficulty":2,"daysToGerminate":21,"daysToHarvest":75,"harvestWindowDays":120,"sunHoursMin":4,"sunHoursOptimal":6,"tempMinC":10,"tempOptimalC":20,"tempMaxC":28,"humidityPctRange":[50,75],"waterNeed":"medium","mlPerPlantPerDay":180,"soilPHRange":[6.0,7.0],"soilType":["loamy"],"spacingCm":20,"depthCm":18,"containerSizeL":4,"kcal":36,"proteinG":3.0,"fiberG":3.3,"vitCmg":133,"ironMg":6.2,"seasons":["rabi","zaid"],"climateZones":["temperate","subtropical"],"indiaRegions":["north","central"],"yieldKgPerPlant":0.10,"commonPests":["aphids"],"commonDiseases":["leaf spot"],"companions":["tomato","carrot","corn"],"antagonists":["mint","lettuce"]},
  {"id":"lemongrass","name":"Lemongrass","aliases":["Gandhatrina","నిమ్మగడ్డి"],"category":"herb","emoji":"🌿","family":"Poaceae","difficulty":1,"daysToGerminate":21,"daysToHarvest":120,"harvestWindowDays":1095,"sunHoursMin":6,"sunHoursOptimal":8,"tempMinC":20,"tempOptimalC":28,"tempMaxC":38,"humidityPctRange":[60,85],"waterNeed":"medium","mlPerPlantPerDay":300,"soilPHRange":[5.5,7.5],"soilType":["loamy","well-drained"],"spacingCm":60,"depthCm":25,"containerSizeL":10,"kcal":99,"proteinG":1.8,"fiberG":0.0,"vitCmg":2.6,"ironMg":8.2,"seasons":["year-round"],"climateZones":["tropical","humid"],"indiaRegions":["south","east","west"],"yieldKgPerPlant":0.4,"commonPests":["aphids"],"commonDiseases":["rust"],"companions":["chilli","ginger"],"antagonists":[]},
  {"id":"ajwain","name":"Ajwain","aliases":["Carom","వాము"],"category":"herb","emoji":"🌿","family":"Apiaceae","difficulty":1,"daysToGerminate":10,"daysToHarvest":150,"harvestWindowDays":30,"sunHoursMin":5,"sunHoursOptimal":7,"tempMinC":15,"tempOptimalC":22,"tempMaxC":30,"humidityPctRange":[40,65],"waterNeed":"low","mlPerPlantPerDay":120,"soilPHRange":[6.5,7.5],"soilType":["loamy","sandy-loam"],"spacingCm":30,"depthCm":15,"containerSizeL":4,"kcal":305,"proteinG":15.9,"fiberG":11.9,"vitCmg":21,"ironMg":12.5,"seasons":["rabi"],"climateZones":["subtropical","arid"],"indiaRegions":["north","central","west"],"yieldKgPerPlant":0.05,"commonPests":["aphids"],"commonDiseases":["powdery mildew"],"companions":["coriander"],"antagonists":[]},
  {"id":"chives","name":"Chives","aliases":[],"category":"herb","emoji":"🌿","family":"Amaryllidaceae","difficulty":1,"daysToGerminate":14,"daysToHarvest":60,"harvestWindowDays":730,"sunHoursMin":4,"sunHoursOptimal":6,"tempMinC":10,"tempOptimalC":18,"tempMaxC":28,"humidityPctRange":[50,75],"waterNeed":"medium","mlPerPlantPerDay":150,"soilPHRange":[6.0,7.0],"soilType":["loamy"],"spacingCm":15,"depthCm":15,"containerSizeL":3,"kcal":30,"proteinG":3.3,"fiberG":2.5,"vitCmg":58,"ironMg":1.6,"seasons":["rabi","zaid"],"climateZones":["temperate","subtropical"],"indiaRegions":["north","central"],"yieldKgPerPlant":0.10,"commonPests":["thrips"],"commonDiseases":["downy mildew"],"companions":["carrot","tomato"],"antagonists":["beans","peas"]},
  {"id":"sage","name":"Sage","aliases":[],"category":"herb","emoji":"🌿","family":"Lamiaceae","difficulty":2,"daysToGerminate":14,"daysToHarvest":75,"harvestWindowDays":1095,"sunHoursMin":6,"sunHoursOptimal":8,"tempMinC":10,"tempOptimalC":20,"tempMaxC":28,"humidityPctRange":[40,60],"waterNeed":"low","mlPerPlantPerDay":120,"soilPHRange":[6.5,7.5],"soilType":["sandy","well-drained"],"spacingCm":45,"depthCm":25,"containerSizeL":6,"kcal":315,"proteinG":10.6,"fiberG":40.3,"vitCmg":32,"ironMg":28.1,"seasons":["rabi"],"climateZones":["temperate","arid"],"indiaRegions":["north","central"],"yieldKgPerPlant":0.10,"commonPests":["spider mites"],"commonDiseases":["root rot"],"companions":["rosemary","cabbage","carrot"],"antagonists":["cucumber","onion"]}
]
